<!ELEMENT branches (branch+)>
<!ELEMENT branch (address, phone, hours, map)>
<!ELEMENT address (#PCDATA)>
<!ELEMENT phone (#PCDATA)>
<!ELEMENT hours (#PCDATA)>
<!ELEMENT map (#PCDATA)>